{
  "schema": "gift.author-module/1",
  "moduleId": "studio:extensions",
  "namespace": "studio.extensions",
  "dialects": {
    "req": {
      "languageId": "gift.requirement-structure",
      "constraint": "1"
    }
  },
  "imports": {
    "ide": {
      "mode": "workspace",
      "moduleId": "gift/spec/ide"
    },
    "extension": {
      "mode": "workspace",
      "moduleId": "gift/spec/extension"
    },
    "policy": {
      "mode": "workspace",
      "moduleId": "gift/spec/policy"
    },
    "settings": {
      "mode": "workspace",
      "moduleId": "gift/spec/settings"
    }
  },
  "definitions": {
    "d:Extensions": {
      "kind": "req:composite",
      "name": "Extensions",
      "body": {
        "parameters": {
          "s": {
            "role": "subject",
            "type": {
              "ref": {
                "import": "ide",
                "export": "Workbench"
              }
            }
          }
        },
        "terms": [
          {
            "require": {
              "import": "extension",
              "export": "Execution"
            },
            "fields": {
              "on": {
                "parameter": "s",
                "path": [
                  "extensions"
                ]
              },
              "effects": {
                "parameter": "s",
                "path": [
                  "effects"
                ]
              },
              "modes": [
                {
                  "enum": {
                    "import": "extension",
                    "export": "DeclarativeContribution"
                  }
                },
                {
                  "enum": {
                    "import": "extension",
                    "export": "IsolatedExecutable"
                  }
                }
              ],
              "authority": {
                "enum": {
                  "import": "extension",
                  "export": "DeclaredAndGranted"
                }
              },
              "failure": {
                "enum": {
                  "import": "extension",
                  "export": "ContainAndDisable"
                }
              }
            }
          },
          {
            "require": {
              "import": "extension",
              "export": "Compatibility"
            },
            "fields": {
              "on": {
                "parameter": "s",
                "path": [
                  "extensions"
                ]
              },
              "api": {
                "enum": {
                  "import": "extension",
                  "export": "VersionedCapability"
                }
              },
              "installed": {
                "enum": {
                  "import": "extension",
                  "export": "ExactContent"
                }
              },
              "unknown": {
                "enum": {
                  "import": "extension",
                  "export": "RejectUnsupportedRequirement"
                }
              }
            }
          },
          {
            "require": {
              "import": "settings",
              "export": "Configuration"
            },
            "fields": {
              "on": {
                "parameter": "s",
                "path": [
                  "settings"
                ]
              },
              "scopes": [
                {
                  "enum": {
                    "import": "settings",
                    "export": "Product"
                  }
                },
                {
                  "enum": {
                    "import": "settings",
                    "export": "Workspace"
                  }
                },
                {
                  "enum": {
                    "import": "settings",
                    "export": "User"
                  }
                }
              ],
              "precedence": {
                "enum": {
                  "import": "settings",
                  "export": "ExplicitSchemaOrder"
                }
              },
              "secret": {
                "enum": {
                  "import": "settings",
                  "export": "ReferenceOnly"
                }
              },
              "changes": {
                "enum": {
                  "import": "settings",
                  "export": "Versioned"
                }
              }
            }
          },
          {
            "require": {
              "import": "policy",
              "export": "Network"
            },
            "fields": {
              "on": {
                "parameter": "s",
                "path": [
                  "effects"
                ]
              },
              "policy": {
                "enum": {
                  "import": "policy",
                  "export": "OriginAndPurposeGrant"
                }
              },
              "background": {
                "enum": {
                  "import": "policy",
                  "export": "DeniedUnlessGranted"
                }
              }
            }
          },
          {
            "require": {
              "import": "policy",
              "export": "Destruction"
            },
            "fields": {
              "on": {
                "parameter": "s",
                "path": [
                  "effects"
                ]
              },
              "policy": {
                "enum": {
                  "import": "policy",
                  "export": "ScopeAndRevisionGrant"
                }
              },
              "retry": {
                "enum": {
                  "import": "policy",
                  "export": "OnlyEffectiveIdempotencyOrFinality"
                }
              }
            }
          }
        ]
      }
    }
  },
  "exports": {
    "Extensions": {
      "definitionId": "d:Extensions"
    }
  }
}
