{
  "schema": "gift.author-module/1",
  "moduleId": "example:form:command",
  "namespace": "example.form.command",
  "dialects": {
    "req": {
      "languageId": "gift.requirement-structure",
      "constraint": "1"
    }
  },
  "imports": {
    "spec": {
      "mode": "workspace",
      "moduleId": "example/spec/normalization"
    },
    "behavior": {
      "mode": "workspace",
      "moduleId": "example:normalization"
    }
  },
  "definitions": {
    "d:Command": {
      "kind": "req:composite",
      "name": "Command",
      "body": {
        "parameters": {},
        "subjects": {
          "transform": {
            "type": {
              "ref": {
                "import": "spec",
                "export": "Transform"
              }
            }
          },
          "delivery": {
            "type": {
              "ref": {
                "import": "spec",
                "export": "Delivery"
              }
            }
          }
        },
        "terms": [
          {
            "use": {
              "import": "behavior",
              "export": "Normalize"
            },
            "arguments": {
              "on": {
                "subject": "transform"
              }
            }
          },
          {
            "require": {
              "import": "spec",
              "export": "Emit"
            },
            "fields": {
              "on": {
                "subject": "delivery"
              },
              "operation": {
                "subject": "transform"
              },
              "form": {
                "enum": {
                  "import": "spec",
                  "export": "Command"
                }
              }
            }
          }
        ],
        "exposes": {
          "normalize": {
            "subject": "transform"
          },
          "delivery": {
            "subject": "delivery"
          }
        }
      }
    }
  },
  "exports": {
    "Command": {
      "definitionId": "d:Command"
    }
  }
}
