{
  "schema": "gift.author-module/1",
  "moduleId": "example:deliverable:installer",
  "namespace": "example:deliverable:installer",
  "dialects": {
    "req": {
      "languageId": "gift.requirement-structure",
      "constraint": "1"
    }
  },
  "imports": {
    "spec": {
      "mode": "workspace",
      "moduleId": "example/spec/deliverable-details"
    },
    "forms": {
      "mode": "workspace",
      "moduleId": "example:deliverable-definitions"
    }
  },
  "definitions": {
    "d:App": {
      "kind": "req:composite",
      "name": "App",
      "body": {
        "parameters": {},
        "subjects": {
          "product": {
            "type": {
              "ref": {
                "import": "spec",
                "export": "Product"
              }
            }
          }
        },
        "terms": [
          {
            "use": {
              "import": "forms",
              "export": "Installer"
            },
            "arguments": {
              "on": {
                "subject": "product"
              }
            }
          }
        ],
        "exposes": {
          "product": {
            "subject": "product"
          }
        }
      }
    }
  },
  "exports": {
    "App": {
      "definitionId": "d:App"
    }
  }
}
